<!DOCTYPE dietaries [
    <!ELEMENT dietaries (dietary*)>
    <!ELEMENT dietary (id, name, description)>
    <!ELEMENT id (#PCDATA)>
    <!ELEMENT name (#PCDATA)>
    <!ELEMENT description (#PCDATA)>
]>
